{
  "schema_version": "2.0",
  "name": "Ethylenediaminetetraacetic acid tetrasodium",
  "cas": "10378-23-1",
  "category": null,
  "vendor_example": "Sigma E6511",
  "physical_state": "solid",
  "properties": {
    "is_protein": {
      "value": null,
      "confidence": "low",
      "sources": [
        {
          "type": "claude_inference",
          "ref": "not_yet_assessed",
          "agrees": false
        }
      ]
    },
    "glycerol_pct": null,
    "viscosity_class": null,
    "viscosity_mPas_20C": null,
    "vapor_pressure_kPa_20C": null,
    "is_volatile": {
      "value": null,
      "confidence": "low",
      "sources": [
        {
          "type": "claude_inference",
          "ref": "not_yet_assessed",
          "agrees": false
        }
      ]
    },
    "is_flammable": {
      "value": null,
      "confidence": "low",
      "sources": [
        {
          "type": "claude_inference",
          "ref": "not_yet_assessed",
          "agrees": false
        }
      ]
    },
    "flash_point_C": null,
    "is_light_sensitive": {
      "value": null,
      "confidence": "low",
      "sources": [
        {
          "type": "claude_inference",
          "ref": "not_yet_assessed",
          "agrees": false
        }
      ]
    },
    "is_fluorophore": {
      "value": null,
      "confidence": "low",
      "sources": [
        {
          "type": "claude_inference",
          "ref": "not_yet_assessed",
          "agrees": false
        }
      ]
    },
    "excitation_nm": null,
    "emission_nm": null,
    "is_reducing_agent": {
      "value": null,
      "confidence": "low",
      "sources": [
        {
          "type": "claude_inference",
          "ref": "not_yet_assessed",
          "agrees": false
        }
      ]
    },
    "oxidizes_in_solution": {
      "value": null,
      "confidence": "low",
      "sources": [
        {
          "type": "claude_inference",
          "ref": "not_yet_assessed",
          "agrees": false
        }
      ]
    },
    "solution_half_life_at_4C_days": null,
    "make_fresh": {
      "value": null,
      "confidence": "low",
      "sources": [
        {
          "type": "claude_inference",
          "ref": "not_yet_assessed",
          "agrees": false
        }
      ]
    },
    "is_detergent": {
      "value": null,
      "confidence": "low",
      "sources": [
        {
          "type": "claude_inference",
          "ref": "not_yet_assessed",
          "agrees": false
        }
      ]
    },
    "is_foaming": {
      "value": null,
      "confidence": "low",
      "sources": [
        {
          "type": "claude_inference",
          "ref": "not_yet_assessed",
          "agrees": false
        }
      ]
    },
    "is_fixative": {
      "value": null,
      "confidence": "low",
      "sources": [
        {
          "type": "claude_inference",
          "ref": "not_yet_assessed",
          "agrees": false
        }
      ]
    },
    "fume_hood_required": {
      "value": true,
      "confidence": "high",
      "sources": [
        {
          "type": "claude_inference",
          "ref": "not_yet_assessed",
          "agrees": false
        },
        {
          "type": "sds_phrase",
          "ref": "section_7:'Work under hood'",
          "agrees": true
        }
      ]
    },
    "is_hygroscopic": {
      "value": null,
      "confidence": "low",
      "sources": [
        {
          "type": "claude_inference",
          "ref": "not_yet_assessed",
          "agrees": false
        }
      ]
    },
    "is_deliquescent": {
      "value": null,
      "confidence": "low",
      "sources": [
        {
          "type": "claude_inference",
          "ref": "not_yet_assessed",
          "agrees": false
        }
      ]
    },
    "is_corrosive": {
      "value": null,
      "confidence": "low",
      "sources": [
        {
          "type": "claude_inference",
          "ref": "not_yet_assessed",
          "agrees": false
        }
      ]
    },
    "is_adsorption_prone": {
      "value": null,
      "confidence": "low",
      "sources": [
        {
          "type": "claude_inference",
          "ref": "not_yet_assessed",
          "agrees": false
        }
      ]
    },
    "lo_bind_required": {
      "value": null,
      "confidence": "low",
      "sources": [
        {
          "type": "claude_inference",
          "ref": "not_yet_assessed",
          "agrees": false
        }
      ]
    },
    "freeze_point_C": null,
    "requires_ice": {
      "value": null,
      "confidence": "low",
      "sources": [
        {
          "type": "claude_inference",
          "ref": "not_yet_assessed",
          "agrees": false
        }
      ]
    },
    "freeze_thaw_max_cycles": null,
    "skin_penetrant": {
      "value": null,
      "confidence": "low",
      "sources": [
        {
          "type": "claude_inference",
          "ref": "not_yet_assessed",
          "agrees": false
        }
      ]
    },
    "plastic_incompatible": [],
    "storage_temp_C": null,
    "is_oxidizer": {
      "value": null,
      "confidence": "low",
      "sources": [
        {
          "type": "claude_inference",
          "ref": "not_yet_assessed",
          "agrees": false
        }
      ]
    },
    "is_air_sensitive": {
      "value": null,
      "confidence": "low",
      "sources": [
        {
          "type": "claude_inference",
          "ref": "not_yet_assessed",
          "agrees": false
        }
      ]
    },
    "is_peroxide_forming": {
      "value": null,
      "confidence": "low",
      "sources": [
        {
          "type": "claude_inference",
          "ref": "not_yet_assessed",
          "agrees": false
        }
      ]
    },
    "is_water_reactive": {
      "value": null,
      "confidence": "low",
      "sources": [
        {
          "type": "claude_inference",
          "ref": "not_yet_assessed",
          "agrees": false
        }
      ]
    },
    "is_rnase_decontaminant": {
      "value": null,
      "confidence": "low",
      "sources": [
        {
          "type": "claude_inference",
          "ref": "not_yet_assessed",
          "agrees": false
        }
      ]
    },
    "is_serum": {
      "value": null,
      "confidence": "low",
      "sources": [
        {
          "type": "claude_inference",
          "ref": "not_yet_assessed",
          "agrees": false
        }
      ]
    }
  },
  "ghs": {
    "pictograms": [
      "corrosion",
      "exclamation_mark",
      "health_hazard"
    ],
    "signal_word": "Danger",
    "hazard_statements": [
      "H332 Harmful if swallowed or if inhaled",
      "H318 Causes serious eye damage",
      "H373 May cause damage to organs (Respiratory Tract)"
    ]
  },
  "sds_facts": {
    "storage": "Tightly closed. Dry.",
    "ppe": [
      "nitrile gloves",
      "safety goggles",
      "respiratory protection"
    ],
    "incompatibilities": []
  },
  "bench_knowledge": [
    {
      "rule_id": "fume_hood_toxic",
      "because": "The SDS (Section 7 or 8) specifies ventilation controls or fume hood use for this reagent. This category spans volatile toxic solvents (pyridine, DMF, heptane), cytotoxic and genotoxic compounds (docetaxel, streptozocin, azoxymethane), and reagents whose vapours or aerosols pose an inhalation hazard. A chemical fume hood provides the primary engineering control \u2014 never handle these reagents on the open bench.",
      "cite": "OSHA Laboratory Standard 29 CFR 1910.1450. Manufacturer SDS Section 7/8.",
      "confidence": "high"
    }
  ],
  "sds_source": {
    "revision_date": "11/06/2025",
    "version": "6.10",
    "product_number": "E6511",
    "parsed_sections": [
      1,
      2,
      3,
      4,
      5,
      6,
      7,
      8,
      9,
      10,
      11,
      12,
      13,
      14,
      15,
      16
    ],
    "enrichment_status": "parsed_with_actionable_flags",
    "unmapped_hcodes": [
      "H318",
      "H332",
      "H373"
    ]
  }
}
