{
  "schema_version": "2.0",
  "name": "Streptavidin-Apc",
  "cas": null,
  "cas_note": "recombinant protein or enzyme; CAS unavailable or absent from PubChem",
  "category": "adsorption_prone",
  "vendor_example": "Biolegend Cat# 405207",
  "physical_state": "liquid",
  "properties": {
    "is_protein": {
      "value": true,
      "confidence": "low",
      "sources": [
        {
          "type": "tacit_knowledge",
          "ref": "reagent_class:enzyme",
          "agrees": true
        },
        {
          "type": "claude_inference",
          "ref": "phase2_batch_ingest",
          "agrees": true
        }
      ]
    },
    "is_volatile": {
      "value": false,
      "confidence": "low",
      "sources": [
        {
          "type": "claude_inference",
          "ref": "not_yet_assessed",
          "agrees": false
        },
        {
          "type": "claude_inference",
          "ref": "phase2_batch_ingest",
          "agrees": false
        }
      ]
    },
    "is_flammable": {
      "value": false,
      "confidence": "low",
      "sources": [
        {
          "type": "claude_inference",
          "ref": "not_yet_assessed",
          "agrees": false
        },
        {
          "type": "claude_inference",
          "ref": "phase2_batch_ingest",
          "agrees": false
        }
      ]
    },
    "is_light_sensitive": {
      "value": false,
      "confidence": "low",
      "sources": [
        {
          "type": "claude_inference",
          "ref": "not_yet_assessed",
          "agrees": false
        },
        {
          "type": "claude_inference",
          "ref": "phase2_batch_ingest",
          "agrees": false
        }
      ]
    },
    "is_fluorophore": {
      "value": false,
      "confidence": "low",
      "sources": [
        {
          "type": "claude_inference",
          "ref": "not_yet_assessed",
          "agrees": false
        },
        {
          "type": "claude_inference",
          "ref": "phase2_batch_ingest",
          "agrees": false
        }
      ]
    },
    "is_reducing_agent": {
      "value": false,
      "confidence": "low",
      "sources": [
        {
          "type": "claude_inference",
          "ref": "not_yet_assessed",
          "agrees": false
        },
        {
          "type": "claude_inference",
          "ref": "phase2_batch_ingest",
          "agrees": false
        }
      ]
    },
    "oxidizes_in_solution": {
      "value": false,
      "confidence": "low",
      "sources": [
        {
          "type": "claude_inference",
          "ref": "not_yet_assessed",
          "agrees": false
        },
        {
          "type": "claude_inference",
          "ref": "phase2_batch_ingest",
          "agrees": false
        }
      ]
    },
    "make_fresh": {
      "value": false,
      "confidence": "low",
      "sources": [
        {
          "type": "claude_inference",
          "ref": "not_yet_assessed",
          "agrees": false
        },
        {
          "type": "claude_inference",
          "ref": "phase2_batch_ingest",
          "agrees": false
        }
      ]
    },
    "is_detergent": {
      "value": false,
      "confidence": "low",
      "sources": [
        {
          "type": "claude_inference",
          "ref": "not_yet_assessed",
          "agrees": false
        },
        {
          "type": "claude_inference",
          "ref": "phase2_batch_ingest",
          "agrees": false
        }
      ]
    },
    "is_foaming": {
      "value": false,
      "confidence": "low",
      "sources": [
        {
          "type": "claude_inference",
          "ref": "not_yet_assessed",
          "agrees": false
        },
        {
          "type": "claude_inference",
          "ref": "phase2_batch_ingest",
          "agrees": false
        }
      ]
    },
    "is_fixative": {
      "value": false,
      "confidence": "low",
      "sources": [
        {
          "type": "claude_inference",
          "ref": "not_yet_assessed",
          "agrees": false
        },
        {
          "type": "claude_inference",
          "ref": "phase2_batch_ingest",
          "agrees": false
        }
      ]
    },
    "fume_hood_required": {
      "value": null,
      "confidence": "low",
      "sources": [
        {
          "type": "claude_inference",
          "ref": "not_yet_assessed",
          "agrees": false
        }
      ]
    },
    "is_hygroscopic": {
      "value": false,
      "confidence": "low",
      "sources": [
        {
          "type": "claude_inference",
          "ref": "not_yet_assessed",
          "agrees": false
        },
        {
          "type": "claude_inference",
          "ref": "phase2_batch_ingest",
          "agrees": false
        }
      ]
    },
    "is_deliquescent": {
      "value": false,
      "confidence": "low",
      "sources": [
        {
          "type": "claude_inference",
          "ref": "not_yet_assessed",
          "agrees": false
        },
        {
          "type": "claude_inference",
          "ref": "phase2_batch_ingest",
          "agrees": false
        }
      ]
    },
    "is_corrosive": {
      "value": false,
      "confidence": "low",
      "sources": [
        {
          "type": "claude_inference",
          "ref": "not_yet_assessed",
          "agrees": false
        },
        {
          "type": "claude_inference",
          "ref": "phase2_batch_ingest",
          "agrees": false
        }
      ]
    },
    "is_adsorption_prone": {
      "value": true,
      "confidence": "low",
      "sources": [
        {
          "type": "claude_inference",
          "ref": "not_yet_assessed",
          "agrees": false
        },
        {
          "type": "claude_inference",
          "ref": "phase2_batch_ingest",
          "agrees": true
        }
      ]
    },
    "lo_bind_required": {
      "value": true,
      "confidence": "low",
      "sources": [
        {
          "type": "claude_inference",
          "ref": "not_yet_assessed",
          "agrees": false
        },
        {
          "type": "claude_inference",
          "ref": "phase2_batch_ingest",
          "agrees": true
        }
      ]
    },
    "requires_ice": {
      "value": true,
      "confidence": "low",
      "sources": [
        {
          "type": "claude_inference",
          "ref": "not_yet_assessed",
          "agrees": false
        },
        {
          "type": "claude_inference",
          "ref": "phase2_batch_ingest",
          "agrees": true
        }
      ]
    },
    "skin_penetrant": {
      "value": false,
      "confidence": "low",
      "sources": [
        {
          "type": "claude_inference",
          "ref": "not_yet_assessed",
          "agrees": false
        },
        {
          "type": "claude_inference",
          "ref": "phase2_batch_ingest",
          "agrees": false
        }
      ]
    },
    "is_oxidizer": {
      "value": null,
      "confidence": "low",
      "sources": [
        {
          "type": "claude_inference",
          "ref": "not_yet_assessed",
          "agrees": false
        }
      ]
    },
    "is_air_sensitive": {
      "value": null,
      "confidence": "low",
      "sources": [
        {
          "type": "claude_inference",
          "ref": "not_yet_assessed",
          "agrees": false
        }
      ]
    },
    "is_peroxide_forming": {
      "value": null,
      "confidence": "low",
      "sources": [
        {
          "type": "claude_inference",
          "ref": "not_yet_assessed",
          "agrees": false
        }
      ]
    },
    "is_water_reactive": {
      "value": null,
      "confidence": "low",
      "sources": [
        {
          "type": "claude_inference",
          "ref": "not_yet_assessed",
          "agrees": false
        }
      ]
    },
    "is_rnase_decontaminant": {
      "value": null,
      "confidence": "low",
      "sources": [
        {
          "type": "claude_inference",
          "ref": "not_yet_assessed",
          "agrees": false
        }
      ]
    },
    "is_serum": {
      "value": null,
      "confidence": "low",
      "sources": [
        {
          "type": "claude_inference",
          "ref": "not_yet_assessed",
          "agrees": false
        }
      ]
    },
    "glycerol_pct": 50
  },
  "ghs": {
    "pictograms": [],
    "signal_word": null,
    "hazard_statements": []
  },
  "sds_facts": {
    "storage": "",
    "ppe": [],
    "incompatibilities": []
  },
  "bench_knowledge": [
    {
      "rule_id": "protein_keep_on_ice",
      "because": "Proteins lose activity rapidly above 4\u00b0C via thermal denaturation and proteolytic degradation. Even brief exposure to room temperature can reduce the activity of sensitive enzymes (reverse transcriptase, ligase, Klenow) by 20\u201350%. Keep vials on ice throughout the entire workflow. Vortexing creates a high-shear air\u2013water interface that can unfold proteins; mix by gentle inversion or brief centrifugation instead.",
      "cite": "NEB Enzyme Storage and Handling Guidelines. Sambrook J & Russell DW (2001) Molecular Cloning 3rd ed., Appendix 1.",
      "confidence": "low"
    }
  ]
}
