{
  "name": "\u03b2-Nicotinamide adenine dinucleotide hydrate",
  "cas": "53-84-9",
  "category": null,
  "vendor_example": "Sigma-Aldrich N1511",
  "physical_state": "powder",
  "properties": {
    "is_protein": {
      "value": null,
      "confidence": "low",
      "sources": [
        {
          "type": "claude_inference",
          "ref": "not_yet_assessed",
          "agrees": false
        }
      ]
    },
    "glycerol_pct": null,
    "viscosity_class": null,
    "viscosity_mPas_20C": null,
    "vapor_pressure_kPa_20C": 0.0,
    "is_volatile": {
      "value": false,
      "confidence": "low",
      "sources": [
        {
          "type": "claude_inference",
          "ref": "not_yet_assessed",
          "agrees": false
        }
      ]
    },
    "is_flammable": {
      "value": null,
      "confidence": "low",
      "sources": [
        {
          "type": "claude_inference",
          "ref": "not_yet_assessed",
          "agrees": false
        }
      ]
    },
    "flash_point_C": null,
    "is_light_sensitive": {
      "value": null,
      "confidence": "low",
      "sources": [
        {
          "type": "claude_inference",
          "ref": "not_yet_assessed",
          "agrees": false
        }
      ]
    },
    "is_fluorophore": {
      "value": null,
      "confidence": "low",
      "sources": [
        {
          "type": "claude_inference",
          "ref": "not_yet_assessed",
          "agrees": false
        }
      ]
    },
    "excitation_nm": null,
    "emission_nm": null,
    "is_reducing_agent": {
      "value": null,
      "confidence": "low",
      "sources": [
        {
          "type": "claude_inference",
          "ref": "not_yet_assessed",
          "agrees": false
        }
      ]
    },
    "oxidizes_in_solution": {
      "value": null,
      "confidence": "low",
      "sources": [
        {
          "type": "claude_inference",
          "ref": "not_yet_assessed",
          "agrees": false
        }
      ]
    },
    "solution_half_life_at_4C_days": null,
    "make_fresh": {
      "value": null,
      "confidence": "low",
      "sources": [
        {
          "type": "claude_inference",
          "ref": "not_yet_assessed",
          "agrees": false
        }
      ]
    },
    "is_detergent": {
      "value": null,
      "confidence": "low",
      "sources": [
        {
          "type": "claude_inference",
          "ref": "not_yet_assessed",
          "agrees": false
        }
      ]
    },
    "is_foaming": {
      "value": null,
      "confidence": "low",
      "sources": [
        {
          "type": "claude_inference",
          "ref": "not_yet_assessed",
          "agrees": false
        }
      ]
    },
    "is_fixative": {
      "value": null,
      "confidence": "low",
      "sources": [
        {
          "type": "claude_inference",
          "ref": "not_yet_assessed",
          "agrees": false
        }
      ]
    },
    "fume_hood_required": {
      "value": null,
      "confidence": "low",
      "sources": [
        {
          "type": "claude_inference",
          "ref": "not_yet_assessed",
          "agrees": false
        }
      ]
    },
    "is_hygroscopic": {
      "value": null,
      "confidence": "low",
      "sources": [
        {
          "type": "claude_inference",
          "ref": "not_yet_assessed",
          "agrees": false
        }
      ]
    },
    "is_deliquescent": {
      "value": null,
      "confidence": "low",
      "sources": [
        {
          "type": "claude_inference",
          "ref": "not_yet_assessed",
          "agrees": false
        }
      ]
    },
    "is_corrosive": {
      "value": null,
      "confidence": "low",
      "sources": [
        {
          "type": "claude_inference",
          "ref": "not_yet_assessed",
          "agrees": false
        }
      ]
    },
    "is_adsorption_prone": {
      "value": null,
      "confidence": "low",
      "sources": [
        {
          "type": "claude_inference",
          "ref": "not_yet_assessed",
          "agrees": false
        }
      ]
    },
    "lo_bind_required": {
      "value": null,
      "confidence": "low",
      "sources": [
        {
          "type": "claude_inference",
          "ref": "not_yet_assessed",
          "agrees": false
        }
      ]
    },
    "freeze_point_C": null,
    "requires_ice": {
      "value": null,
      "confidence": "low",
      "sources": [
        {
          "type": "claude_inference",
          "ref": "not_yet_assessed",
          "agrees": false
        }
      ]
    },
    "freeze_thaw_max_cycles": null,
    "skin_penetrant": {
      "value": null,
      "confidence": "low",
      "sources": [
        {
          "type": "claude_inference",
          "ref": "not_yet_assessed",
          "agrees": false
        }
      ]
    },
    "plastic_incompatible": [],
    "storage_temp_C": -20.0,
    "is_oxidizer": {
      "value": null,
      "confidence": "low",
      "sources": [
        {
          "type": "claude_inference",
          "ref": "not_yet_assessed",
          "agrees": false
        }
      ]
    },
    "is_air_sensitive": {
      "value": null,
      "confidence": "low",
      "sources": [
        {
          "type": "claude_inference",
          "ref": "not_yet_assessed",
          "agrees": false
        }
      ]
    },
    "is_peroxide_forming": {
      "value": null,
      "confidence": "low",
      "sources": [
        {
          "type": "claude_inference",
          "ref": "not_yet_assessed",
          "agrees": false
        }
      ]
    },
    "is_water_reactive": {
      "value": null,
      "confidence": "low",
      "sources": [
        {
          "type": "claude_inference",
          "ref": "not_yet_assessed",
          "agrees": false
        }
      ]
    },
    "is_rnase_decontaminant": {
      "value": null,
      "confidence": "low",
      "sources": [
        {
          "type": "claude_inference",
          "ref": "not_yet_assessed",
          "agrees": false
        }
      ]
    },
    "is_serum": {
      "value": null,
      "confidence": "low",
      "sources": [
        {
          "type": "claude_inference",
          "ref": "not_yet_assessed",
          "agrees": false
        }
      ]
    }
  },
  "ghs": {
    "pictograms": [],
    "signal_word": null,
    "hazard_statements": []
  },
  "sds_facts": {
    "storage": "Store at -20\u00b0C (freezer).",
    "ppe": [
      "nitrile gloves",
      "safety glasses",
      "respiratory protection"
    ],
    "incompatibilities": []
  },
  "bench_knowledge": [],
  "sds_source": {
    "revision_date": "11/06/2025",
    "version": "6.7",
    "product_number": "N1511"
  },
  "schema_version": "2.0"
}
