{
  "schema_version": "2.0",
  "name": "Anti-Biotin Microbeads",
  "cas": null,
  "cas_note": "antibody; no CAS",
  "category": "adsorption_prone",
  "vendor_example": "Miltenyi Biotec 130-090-485",
  "physical_state": "liquid",
  "properties": {
    "is_protein": {
      "value": true,
      "confidence": "low",
      "sources": [
        {
          "type": "tacit_knowledge",
          "ref": "reagent_class:antibody",
          "agrees": true
        },
        {
          "type": "claude_inference",
          "ref": "phase2_batch_ingest",
          "agrees": true
        }
      ]
    },
    "is_volatile": {
      "value": false,
      "confidence": "low",
      "sources": [
        {
          "type": "claude_inference",
          "ref": "not_yet_assessed",
          "agrees": false
        },
        {
          "type": "claude_inference",
          "ref": "phase2_batch_ingest",
          "agrees": false
        }
      ]
    },
    "is_flammable": {
      "value": false,
      "confidence": "low",
      "sources": [
        {
          "type": "claude_inference",
          "ref": "not_yet_assessed",
          "agrees": false
        },
        {
          "type": "claude_inference",
          "ref": "phase2_batch_ingest",
          "agrees": false
        }
      ]
    },
    "is_light_sensitive": {
      "value": false,
      "confidence": "low",
      "sources": [
        {
          "type": "claude_inference",
          "ref": "not_yet_assessed",
          "agrees": false
        },
        {
          "type": "claude_inference",
          "ref": "phase2_batch_ingest",
          "agrees": false
        }
      ]
    },
    "is_fluorophore": {
      "value": false,
      "confidence": "low",
      "sources": [
        {
          "type": "claude_inference",
          "ref": "not_yet_assessed",
          "agrees": false
        },
        {
          "type": "claude_inference",
          "ref": "phase2_batch_ingest",
          "agrees": false
        }
      ]
    },
    "is_reducing_agent": {
      "value": false,
      "confidence": "low",
      "sources": [
        {
          "type": "claude_inference",
          "ref": "not_yet_assessed",
          "agrees": false
        },
        {
          "type": "claude_inference",
          "ref": "phase2_batch_ingest",
          "agrees": false
        }
      ]
    },
    "oxidizes_in_solution": {
      "value": false,
      "confidence": "low",
      "sources": [
        {
          "type": "claude_inference",
          "ref": "not_yet_assessed",
          "agrees": false
        },
        {
          "type": "claude_inference",
          "ref": "phase2_batch_ingest",
          "agrees": false
        }
      ]
    },
    "make_fresh": {
      "value": false,
      "confidence": "low",
      "sources": [
        {
          "type": "claude_inference",
          "ref": "not_yet_assessed",
          "agrees": false
        },
        {
          "type": "claude_inference",
          "ref": "phase2_batch_ingest",
          "agrees": false
        }
      ]
    },
    "is_detergent": {
      "value": false,
      "confidence": "low",
      "sources": [
        {
          "type": "claude_inference",
          "ref": "not_yet_assessed",
          "agrees": false
        },
        {
          "type": "claude_inference",
          "ref": "phase2_batch_ingest",
          "agrees": false
        }
      ]
    },
    "is_foaming": {
      "value": false,
      "confidence": "low",
      "sources": [
        {
          "type": "claude_inference",
          "ref": "not_yet_assessed",
          "agrees": false
        },
        {
          "type": "claude_inference",
          "ref": "phase2_batch_ingest",
          "agrees": false
        }
      ]
    },
    "is_fixative": {
      "value": false,
      "confidence": "low",
      "sources": [
        {
          "type": "claude_inference",
          "ref": "not_yet_assessed",
          "agrees": false
        },
        {
          "type": "claude_inference",
          "ref": "phase2_batch_ingest",
          "agrees": false
        }
      ]
    },
    "fume_hood_required": {
      "value": null,
      "confidence": "low",
      "sources": [
        {
          "type": "claude_inference",
          "ref": "not_yet_assessed",
          "agrees": false
        }
      ]
    },
    "is_hygroscopic": {
      "value": false,
      "confidence": "low",
      "sources": [
        {
          "type": "claude_inference",
          "ref": "not_yet_assessed",
          "agrees": false
        },
        {
          "type": "claude_inference",
          "ref": "phase2_batch_ingest",
          "agrees": false
        }
      ]
    },
    "is_deliquescent": {
      "value": false,
      "confidence": "low",
      "sources": [
        {
          "type": "claude_inference",
          "ref": "not_yet_assessed",
          "agrees": false
        },
        {
          "type": "claude_inference",
          "ref": "phase2_batch_ingest",
          "agrees": false
        }
      ]
    },
    "is_corrosive": {
      "value": false,
      "confidence": "low",
      "sources": [
        {
          "type": "claude_inference",
          "ref": "not_yet_assessed",
          "agrees": false
        },
        {
          "type": "claude_inference",
          "ref": "phase2_batch_ingest",
          "agrees": false
        }
      ]
    },
    "is_adsorption_prone": {
      "value": true,
      "confidence": "low",
      "sources": [
        {
          "type": "tacit_knowledge",
          "ref": "reagent_class:antibody",
          "agrees": true
        },
        {
          "type": "claude_inference",
          "ref": "phase2_batch_ingest",
          "agrees": true
        }
      ]
    },
    "lo_bind_required": {
      "value": true,
      "confidence": "low",
      "sources": [
        {
          "type": "claude_inference",
          "ref": "not_yet_assessed",
          "agrees": false
        },
        {
          "type": "claude_inference",
          "ref": "phase2_batch_ingest",
          "agrees": true
        }
      ]
    },
    "requires_ice": {
      "value": true,
      "confidence": "low",
      "sources": [
        {
          "type": "claude_inference",
          "ref": "not_yet_assessed",
          "agrees": false
        },
        {
          "type": "claude_inference",
          "ref": "phase2_batch_ingest",
          "agrees": true
        }
      ]
    },
    "skin_penetrant": {
      "value": false,
      "confidence": "low",
      "sources": [
        {
          "type": "claude_inference",
          "ref": "not_yet_assessed",
          "agrees": false
        },
        {
          "type": "claude_inference",
          "ref": "phase2_batch_ingest",
          "agrees": false
        }
      ]
    },
    "is_oxidizer": {
      "value": null,
      "confidence": "low",
      "sources": [
        {
          "type": "claude_inference",
          "ref": "not_yet_assessed",
          "agrees": false
        }
      ]
    },
    "is_air_sensitive": {
      "value": null,
      "confidence": "low",
      "sources": [
        {
          "type": "claude_inference",
          "ref": "not_yet_assessed",
          "agrees": false
        }
      ]
    },
    "is_peroxide_forming": {
      "value": null,
      "confidence": "low",
      "sources": [
        {
          "type": "claude_inference",
          "ref": "not_yet_assessed",
          "agrees": false
        }
      ]
    },
    "is_water_reactive": {
      "value": null,
      "confidence": "low",
      "sources": [
        {
          "type": "claude_inference",
          "ref": "not_yet_assessed",
          "agrees": false
        }
      ]
    },
    "is_rnase_decontaminant": {
      "value": null,
      "confidence": "low",
      "sources": [
        {
          "type": "claude_inference",
          "ref": "not_yet_assessed",
          "agrees": false
        }
      ]
    },
    "is_serum": {
      "value": null,
      "confidence": "low",
      "sources": [
        {
          "type": "claude_inference",
          "ref": "not_yet_assessed",
          "agrees": false
        }
      ]
    },
    "glycerol_pct": 50
  },
  "ghs": {
    "pictograms": [],
    "signal_word": null,
    "hazard_statements": []
  },
  "sds_facts": {
    "storage": "",
    "ppe": [],
    "incompatibilities": []
  },
  "bench_knowledge": [
    {
      "rule_id": "protein_keep_on_ice",
      "because": "Proteins lose activity rapidly above 4\u00b0C via thermal denaturation and proteolytic degradation. Even brief exposure to room temperature can reduce the activity of sensitive enzymes (reverse transcriptase, ligase, Klenow) by 20\u201350%. Keep vials on ice throughout the entire workflow. Vortexing creates a high-shear air\u2013water interface that can unfold proteins; mix by gentle inversion or brief centrifugation instead.",
      "cite": "NEB Enzyme Storage and Handling Guidelines. Sambrook J & Russell DW (2001) Molecular Cloning 3rd ed., Appendix 1.",
      "confidence": "low"
    },
    {
      "rule_id": "lo_bind_adsorption_prone",
      "because": "Proteins, oligonucleotides, and antibodies at low concentrations lose significant material to non-specific adsorption onto standard polypropylene and polystyrene surfaces within 30\u201360 minutes, particularly below 100 \u00b5g/mL. LoBind surfaces have reduced hydrophobic character; adding BSA or another carrier protein competes for adsorption sites and stabilises the stock at very low concentrations.",
      "cite": "Eppendorf LoBind Technology Technical Note, 2019. Kingston RE et al. (2003) Current Protocols in Mol. Bio.: nucleic acid quantification and dilution.",
      "confidence": "low"
    }
  ]
}
